{
  "id": "web-scraping--firecrawl",
  "vendor": "Firecrawl",
  "category": "web-scraping",
  "status": "tested",
  "jurisdictions": [],
  "tested_use_case": "Web Scraping APIs — Hosted extraction and browser-automation APIs that turn web pages into structured data at scale. Judged against the arena's evidence-graded story taxonomy: 96 user stories across 11 themes.",
  "tested_on": "2026-10-01",
  "reviewer": "Ultrametric pipeline (automated, evidence-graded)",
  "affiliations": [],
  "evidence": [
    {
      "kind": "probe",
      "uri": "https://docs.firecrawl.dev/llms.txt",
      "observed_on": "2026-09-25"
    },
    {
      "kind": "probe",
      "uri": "https://docs.firecrawl.dev/openapi.json",
      "observed_on": "2026-09-25"
    },
    {
      "kind": "probe",
      "uri": "https://github.com/mendableai/firecrawl-mcp-server",
      "observed_on": "2026-09-25"
    },
    {
      "kind": "probe",
      "uri": "https://docs.firecrawl.dev/sdks/cli",
      "observed_on": "2026-09-25"
    },
    {
      "kind": "github",
      "uri": "https://github.com/mendableai/firecrawl",
      "observed_on": "2026-08-28"
    }
  ],
  "pricing": {
    "amount": 5,
    "currency": "USD",
    "observed_on": "2026-09-07",
    "source": "https://www.firecrawl.dev/pricing",
    "unit": "per 1k pages"
  },
  "dimensions": {
    "aiEra": 43.9,
    "agentReady": 68.6,
    "agentic": 44.9,
    "coverageGrade": "C"
  },
  "limitations": [],
  "recheck_due": "2026-12-30"
}
