{
  "id": "local-llm-runtimes--runanywhere",
  "vendor": "RunAnywhere",
  "category": "local-llm-runtimes",
  "status": "tested",
  "jurisdictions": [],
  "tested_use_case": "Local LLM Runtimes — Tools for running large language models on your own hardware across CPU, GPU, and Apple Silicon. Judged against the arena's evidence-graded story taxonomy: 92 user stories across 10 themes.",
  "tested_on": "2026-10-01",
  "reviewer": "Ultrametric pipeline (automated, evidence-graded)",
  "affiliations": [],
  "evidence": [
    {
      "kind": "probe",
      "uri": "https://docs.runanywhere.ai/llms.txt",
      "observed_on": "2026-09-25"
    },
    {
      "kind": "probe",
      "uri": "https://docs.runanywhere.ai/openapi.json",
      "observed_on": "2026-09-25"
    },
    {
      "kind": "probe",
      "uri": "https://github.com/RunanywhereAI/wally/releases",
      "observed_on": "2026-09-25"
    },
    {
      "kind": "github",
      "uri": "https://github.com/RunanywhereAI/runanywhere-sdks",
      "observed_on": "2026-09-25"
    },
    {
      "kind": "claimed-docs",
      "uri": "https://docs.runanywhere.ai/swift/tool-calling.md",
      "observed_on": "2026-09-25"
    }
  ],
  "pricing": {
    "amount": null,
    "currency": null,
    "observed_on": null,
    "source": null,
    "unit": null
  },
  "dimensions": {
    "aiEra": 19.4,
    "agentReady": 39.5,
    "agentic": 7.3,
    "coverageGrade": "D"
  },
  "limitations": [],
  "recheck_due": "2026-12-30"
}
