{
  "id": "project-management--notion",
  "vendor": "Notion",
  "category": "project-management",
  "status": "tested",
  "jurisdictions": [],
  "tested_use_case": "Project Management — Team planning and tracking tools for software and product organizations. Judged against the arena's evidence-graded story taxonomy: 83 user stories across 11 themes.",
  "tested_on": "2026-09-22",
  "reviewer": "Ultrametric pipeline (automated, evidence-graded)",
  "affiliations": [],
  "evidence": [
    {
      "kind": "probe",
      "uri": "https://developers.notion.com/llms.txt",
      "observed_on": "2026-09-16"
    },
    {
      "kind": "probe",
      "uri": "https://developers.notion.com/openapi.json",
      "observed_on": "2026-09-16"
    },
    {
      "kind": "probe",
      "uri": "https://developers.notion.com/docs/mcp",
      "observed_on": "2026-09-16"
    },
    {
      "kind": "claimed-docs",
      "uri": "https://developers.notion.com",
      "observed_on": "2026-08-28"
    },
    {
      "kind": "claimed-docs",
      "uri": "https://developers.notion.com",
      "observed_on": "2026-09-10"
    }
  ],
  "pricing": {
    "amount": null,
    "currency": null,
    "observed_on": null,
    "source": null,
    "unit": null
  },
  "dimensions": {
    "aiEra": 35.2,
    "agentReady": 58.6,
    "agentic": 46.4,
    "coverageGrade": "C"
  },
  "limitations": [],
  "recheck_due": "2026-12-21"
}
